,Titles,Links
0,Stolen Delivery Van Driver Who Led Police In Chase Worked For Amazon - CBS Boston,https://boston.cbslocal.com/2021/08/26/amazon-stolen-delivery-van-cameron-mignon/
1,Amazon's department-store plans are less surprising than they appear - The Economist,https://www.economist.com/business/2021/08/28/amazons-department-store-plans-are-less-surprising-than-they-appear
2,Former Amazon executive who was once Jeff Bezos' 'shadow' joins online events start-up Hopin - CNBC,https://www.cnbc.com/2021/08/26/hopin-hires-former-amazon-exec-who-was-once-jeff-bezos-shadow-advisor.html
3,The 5 best Amazon deals you can get this Thursday - USA TODAY,https://www.usatoday.com/story/money/reviewed/2021/08/26/amazon-deals-save-ring-alarm-disney-plus-bark-box-and-more/5601670001/
4,The women on the front lines of safeguarding the Amazon - Mongabay.com,https://news.mongabay.com/2021/08/the-women-on-the-front-lines-of-safeguarding-the-amazon/
5,Kohl's CEO says rumored Amazon department stores won't ruin its relationship with the e-commerce giant - CNBC,https://www.cnbc.com/2021/08/24/kohls-ceo-rumored-amazon-department-stores-wont-ruin-relationship.html
6,Amazon Prime Gaming's free titles for September include 'Knockout City' - Engadget,https://www.engadget.com/amazon-prime-gamings-free-titles-for-september-include-knockout-city-140025611.html
7,The NLRB's Amazon Antics - uschamber.com,https://www.uschamber.com/article/the-nlrb-s-amazon-antics
8,Microsoft recruits longtime Amazon cloud exec Charlie Bell - The Seattle Times,https://www.seattletimes.com/business/microsoft-recruits-longtime-amazon-cloud-exec-charlie-bell/
9,"New On Amazon Prime Video In September: Daily Listings For Streaming Movies, TV & More - Deadline",https://deadline.com/feature/new-on-amazon-prime-streaming-1234822617/
10,"10 Black-Owned Businesses to Shop on Amazon: Fashion, Beauty, & Home - PEOPLE",https://people.com/lifestyle/black-owned-businesses-amazon/
11,Jennifer Lopez Keeps Wearing the Stylish Reusable Face Mask That Amazon Shoppers Call 'Comfortable and Breathable' - PEOPLE.com,https://people.com/lifestyle/jennifer-lopez-henry-face-mask-amazon/
12,Amazon.com Inc. stock underperforms Thursday when compared to competitors despite daily gains - MarketWatch,https://www.marketwatch.com/story/amazon-com-inc-stock-underperforms-thursday-when-compared-to-competitors-despite-daily-gains-01630009838-7b02768df328
13,12 Best T-Shirts on Amazon for Men - Esquire.com,https://www.esquire.com/style/mens-fashion/g37404694/best-amazon-t-shirts-men/
14,Behind the scenes on Amazon's New World - Creative Bloq,https://www.creativebloq.com/features/amazon-new-world-art
15,"The Best Face Masks for Kids, According to Amazon Reviewers - PEOPLE.com",https://people.com/lifestyle/abg-face-masks-for-kids-amazon/
16,"Jobs for Jacksonians Partners With Amazon for Series of Information Sessions - Jackson, MS - jacksonms.gov",https://www.jacksonms.gov/jobs-for-jacksonians-partners-with-amazon-for-series-of-information-sessions/
17,18 Must-Have Leggings From Amazon | The Best Leggings for Women - ELLE.com,https://www.elle.com/fashion/shopping/g37318203/best-amazon-leggings/
18,Amazon Fresh Opens First Maryland Store to Great Fanfare - Winsight Grocery Business,https://www.winsightgrocerybusiness.com/retailers/amazon-fresh-opens-first-maryland-store-great-fanfare
19,"Don't Panic, But Amazon's Taking Over 50% Off Lodge's Dutch Oven - Delish.com",https://www.delish.com/kitchen-tools/cookware-reviews/a37407467/amazon-lodge-dutch-oven-sale/
20,"Amazon Launches Free Prime Membership for Students, Plus Music Streaming from 99 Cents - Billboard",https://www.billboard.com/articles/news/9612348/amazon-prime-student-discount-pricing-offers/
21,Here’s what makes a new Amazon carbon study so unnerving - Yale Climate Connections,https://yaleclimateconnections.org/2021/08/heres-what-makes-a-new-amazon-carbon-study-so-unnerving/
22,Amazon calls on FCC to reject SpaceX's revised second-gen Starlink plan - SpaceNews,https://spacenews.com/amazon-calls-on-fcc-to-reject-spacexs-revised-second-gen-starlink-plan/
23,"Amazon is reportedly planning to open department stores, its latest experiment in physical retail - CNBC",https://www.cnbc.com/2021/08/19/amazon-is-reportedly-planning-to-open-department-stores-.html
24,Former Amazon grocery leader Wei Gao lands at event management company Hopin - GeekWire,https://www.geekwire.com/2021/former-amazon-grocery-leader-wei-gao-lands-event-management-company-hopin/
25,"The 10 Best Student Discounts You'll Find on Amazon, Apple, Nike, and More - Mental Floss",https://www.mentalfloss.com/article/649706/best-student-discounts-amazon-apple-nike
26,"Over 235k defective hoverboards sold at Walmart, Amazon.com recalled for battery issues - WKRN News 2",https://www.wkrn.com/news/over-235k-defective-hoverboards-sold-at-walmart-amazon-com-recalled-for-battery-issues/
27,3 Expert Opinions On Amazon Stock: Is It A Buy? - TheStreet,https://www.thestreet.com/amazon/stock/3-expert-opinions-on-amazon-stock-is-it-a-buy
28,New Amazon Grocery Store Sets Up Shop in Heart of Seattle’s Central District - southseattleemerald.com,https://southseattleemerald.com/2021/08/23/new-amazon-grocery-store-sets-up-shop-in-heart-of-seattles-central-district/
29,Amazon Disrupts Retail (Again) With New Department Stores - Forbes,https://www.forbes.com/sites/blakemorgan/2021/08/24/amazon-disrupts-retail-again-with-new-department-stores/
30,Amazon to offer free cybersecurity training - Chain Store Age,https://www.chainstoreage.com/amazon-offer-free-cybersecurity-training
31,Amazon teams with SK Telecom for South Korean e-commerce - UPI News,https://www.upi.com/Top_News/World-News/2021/08/26/Amazon-South-Korea-SK-Telecom-ecommerce/7201629990789/
32,"Google, Amazon, Microsoft unveil massive cybersecurity initiatives after White House meeting - CNET",https://www.cnet.com/tech/services-and-software/apple-google-amazon-ceos-head-to-white-house-for-cybersecurity-meeting/
33,Amazon announces open beta for ‘New World’ in early September - GeekWire,https://www.geekwire.com/2021/amazon-announces-open-beta-new-world-early-september/
34,Here's Why I'm Excited About the Amazon of Russia - Motley Fool,https://www.fool.com/investing/2021/08/26/heres-why-im-excited-about-the-amazon-of-russia/
35,Jim Cramer says the turnaround of Best Buy proves Amazon's 'death star days' are over - CNBC,https://www.cnbc.com/2021/08/24/jim-cramer-says-the-turnaround-of-best-buy-proves-amazons-death-star-days-are-over.html
36,"How COVID-19 pandemic, Amazon made retailers fundamentally stronger - ZDNet",https://www.zdnet.com/article/how-covid-19-pandemic-amazon-made-retailers-fundamentally-stronger/
37,The Apple Watch SE (44mm with cellular) is down to $300 at Amazon - Engadget,https://www.engadget.com/apple-watch-se-44mm-cellular-deal-59-off-amazon-131506828.html
38,Viral TikToks show Amazon drivers risking safety for deliveries - Business Insider,https://www.businessinsider.com/viral-tiktok-videos-show-amazon-drivers-risking-safety-deliver-packages-2021-8
39,Bear steals Amazon package in viral video - Fox News,https://www.foxnews.com/great-outdoors/bear-steals-amazon-package-viral-video
40,"Walmart expands last-mile delivery service to outside businesses, opening new battlefront with Amazon - The Washington Post",https://www.washingtonpost.com/business/2021/08/24/walmart-expands-last-mile-delivery-service-outside-businesses-opening-new-battlefront-with-amazon/
41,AT Deals: NZXT Kraken X73 Cooler Lowers to $132 at Amazon - AnandTech,https://www.anandtech.com/show/16916/at-deals-nzxt-kraken-x73-cooler-lowers-to-132-at-amazon
42,Looking Back at Amazon's (AMZN) Missed NYC HQ2 - Investopedia,https://www.investopedia.com/looking-back-at-amazon-s-amzn-missed-nyc-hq2-5198638
43,Amazon Fresh opening in Chevy Chase on Thursday - BethesdaMagazine.com,https://bethesdamagazine.com/bethesda-beat/business/amazon-fresh-opening-in-chevy-chase-on-thursday/
44,Who is Andy Jassy? Amazon's new CEO visits the White House - Yahoo Finance,https://finance.yahoo.com/news/who-is-andy-jassy-amazon-ceo-190316533.html
45,This $5 TikTok-Loved Mascara Is an Amazon Best-Seller & Gives You That False Lash Look - SheKnows,https://www.sheknows.com/living/articles/2481354/tiktok-essence-lash-princess-mascara-amazon/
46,I Used Amazon's Virtual Room Designer to Affordably Furnish My Bedroom - InStyle,https://www.instyle.com/lifestyle/discover-rooms-small-bedroom-room-decor-amazon
47,"Amazon Lands ‘Infinite Thread’ Drama From Justin Lin, Ramsay Brothers, Byron Balasco & Universal TV - Deadline",https://deadline.com/2021/08/amazon-infinite-thread-drama-justin-lin-ramsay-brothers-byron-balasco-1234822721/
48,"Amazon’s European Originals Chief Georgia Brown On Plans To Beef Up Film Slate & Invest In Local, Diverse Talent – Edinburgh - Deadline",https://deadline.com/2021/08/amazon-europa-head-georgia-brown-strength-movies-investing-local-diverse-talent-1234822425/
49,TDOT gets roads ready for Amazon - Knox TN Today,https://www.knoxtntoday.com/east-towne-where-art-thou/
50,Amazon freight terminal rolls out for a rematch - North Bay Business Journal,https://www.northbaybusinessjournal.com/article/article/amazon-freight-terminal-rolls-out-for-a-rematch/
51,Amazon Is Beefing Up Its Already Dystopian Worker Surveillance Machine - Jacobin magazine,https://jacobinmag.com/2021/08/amazon-worker-surveillance
52,Amazon launches website to go on the offensive against Congress' antitrust tech bills - CNBC,https://www.cnbc.com/2021/08/20/amazon-launches-website-to-warn-sellers-about-antitrust-bills.html
53,"Amazon End of Summer Sale: all the best deals on TVs, headphones, laptops and more - TechRadar",https://www.techradar.com/news/amazon-end-of-summer-sale-all-the-best-deals-on-tvs-headphones-laptops-and-more
54,"Dave Eggers' ""The Every"" imagines a Facebook-Amazon monopoly - Quartz",https://qz.com/2051780/dave-eggers-the-every-imagines-a-facebook-amazon-monopoly/
55,"Amazon’s best Air Fryer deal gets you a model with 18,000 5-star ratings for $59.99 - BGR",https://bgr.com/deals/amazons-best-air-fryer-deal-gets-you-a-model-with-18000-5-star-ratings-for-59-99/
56,Amazon PS5 restock now sold out —where to check for inventory next - Tom's Guide,https://www.tomsguide.com/news/amazon-ps5-restock-update-august-2021
57,Why you should be using an Amazon Business account - Komando,https://www.komando.com/small-business/amazon-business-account/804301/
58,HBO Max shrugs off losing 5M subscribers through Amazon Channels - FierceVideo,https://www.fiercevideo.com/video/hbo-max-shrugs-off-losing-5m-subscribers-through-amazon-channels
59,I might never cook again without this $40 Amazon kitchen tool - BGR,https://bgr.com/deals/i-might-never-cook-again-without-this-40-amazon-kitchen-tool/
60,"The Best Amazon Labor Day Sales of 2021 - Top Home, Fashion and School Sales - GoodHousekeeping.com",https://www.goodhousekeeping.com/life/money/g37348516/amazon-labor-day-sales-2021/
61,Amazon’s Department Store Of The Future Could Look Like These 3 Scenarios - Forbes,https://www.forbes.com/sites/christopherwalton/2021/08/23/amazons-department-store-of-the-future-could-look-like-these-3-scenarios/
62,The Tineco Cordless Stick Vacuum Cleaner Is on Sale at Amazon | PEOPLE.com - PEOPLE.com,https://people.com/home/tineco-hero-cordless-stick-vacuum-cleaner-deal-amazon/
63,9 Amazon Deals To Add To Your Cart This Week - Forbes,https://www.forbes.com/sites/forbes-personal-shopper/2021/08/23/amazon-deals/
64,Why Amazon’s Wheel Of Time Changing Character Ages Is The Wrong Choice - Screen Rant,https://screenrant.com/wheel-time-show-characters-ages-older-bad-reason/
65,Incident that ended with gunfire outside Amazon remains under investigation - Kenosha News,https://www.kenoshanews.com/news/local/crime-and-courts/incident-that-ended-with-gunfire-outside-amazon-remains-under-investigation/article_eda213a8-6e12-5ffa-8b7f-311839d3bbd9.html
66,Why the Glowing Trees in Amazon's Lord of the Rings Are So Important - Gizmodo,https://gizmodo.com/why-the-glowing-trees-in-amazons-lord-of-the-rings-are-1847496857
67,6 beauty and fashion bestsellers on Amazon — all under $30 - TODAY,https://www.today.com/shop/august-amazon-bestsellers-t228706
68,"New snags in the global supply chain, Amazon's department store debut, and more - Business of Home",https://businessofhome.com/articles/new-snags-in-the-global-supply-chain-amazon-s-department-store-debut-and-more
69,Amazon.com (NASDAQ:AMZN) is Slowly Converting to a Mature Company with an Emphasis on Cash-Flows and Value Maximization - Yahoo Finance,https://finance.yahoo.com/news/amazon-com-nasdaq-amzn-slowly-204055081.html
70,"Over 230k defective hoverboards sold at Walmart, Amazon.com recalled for battery issues - FOX21News.com",https://www.fox21news.com/video/over-230k-defective-hoverboards-sold-at-walmart-amazon-com-recalled-for-battery-issues/6924320/
71,"As demand for bikes surged, Amazon got in the way - The Verge",https://www.theverge.com/22618306/pacific-northwest-components-bike-company-quit-amazon-support-indie-shops
72,The 5 best Amazon deals you can get this Tuesday - USA TODAY,https://www.usatoday.com/story/money/reviewed/2021/08/24/amazon-deals-shop-discounts-smartwatches-video-doorbells-and-more/5570448001/
73,"Amazon Plans To Open Department Stores, But Not For Reason You Think, Report Says - Harrison Daily Voice",https://dailyvoice.com/new-york/harrison/business/amazon-plans-to-open-department-stores-but-not-for-reason-you-think-report-says/814866/
74,What Is Amazon's Movers & Shakers Page? Here's What To Know - Mental Floss,https://www.mentalfloss.com/article/649758/amazon-movers-shakers-page
75,Wild Amazon Truck Chase Ends in Arrest - NBC10 Boston,https://www.nbcboston.com/news/local/wild-amazon-truck-chase-ends-in-arrest/2476827/
76,Why Amazon is now pledging to make good on bad third-party products - GeekWire,https://www.geekwire.com/2021/amazon-now-pledging-make-good-bad-third-party-products/
77,"Amazon Fresh, other online grocery retailers change way dairy sells - Wisconsin State Farmer",https://www.wisfarmer.com/story/news/2021/08/24/amazon-fresh-other-online-grocery-retailers-change-way-dairy-sells/5577001001/
78,Amazon's 'Baby Step' Toward Accountability for Bad Products - Adweek,https://www.adweek.com/commerce/amazon-baby-step-accountability-for-defective-products/
79,Here's Everything Coming to Amazon Prime Video in September 2021 - Cord Cutters News,https://www.cordcuttersnews.com/heres-everything-coming-to-amazon-prime-video-in-september-2021/
80,Levoit's Best-Selling Air Purifier on Amazon Just Got an Upgrade | PEOPLE.com - PEOPLE.com,https://people.com/home/levoit-core-300s-air-purifier-amazon/
81,Valuable background pieces on the Amazon as a carbon source - Yale Climate Connections,https://yaleclimateconnections.org/2021/08/valuable-background-pieces-on-the-amazon-as-a-carbon-source/
82,Amazon hosts in-person talks about employment opportunities - WLBT,https://www.wlbt.com/2021/08/25/amazon-hosts-in-person-talks-about-employment-opportunities/
83,These Engagement Gift Ideas Can All Be Bought on Amazon | PEOPLE.com - PEOPLE.com,https://people.com/home/engagement-wedding-gifts-amazon-handmade/
84,Amazon Announces Two New Cybersecurity Initiatives Aimed To Protect Organizations and Individuals - Yahoo Finance,https://finance.yahoo.com/news/amazon-announces-two-cybersecurity-initiatives-213000426.html
85,Plainfield woman struck by Amazon delivery van - FOX 61,https://www.fox61.com/article/news/local/plainfield-connecticut-amazon-delivery-van-struck/520-51725463-d2c2-4531-81a8-f2c6d4693029
86,"These CDC-approved, MiUSA N95 masks are 80 cents each on Amazon - SFGate",https://www.sfgate.com/shopping/article/n95-masks-made-in-usa-cheap-amazon-16410997.php
87,Looking for genius products that can solve everyday problems? Check out Amazon Launchpad - CNN,https://www.cnn.com/2021/08/20/cnn-underscored/amazon-launchpad-must-have-products/index.html
88,Space Symposium: Amazon unit finds space ripe for startups - Colorado Springs Gazette,https://gazette.com/business/space-symposium-amazon-unit-finds-space-ripe-for-startups/article_a9d49c42-0690-11ec-9c52-a718c533427b.html
89,"Former Microsoft, Amazon exec sentenced for $5.5 million in PPP fraud - Fortune",https://fortune.com/2021/08/25/ppp-fraud-jail-time-mukund-mohand-microsoft-amazon-executive/
90,These 5 tools on Amazon can replace almost everything in your toolbox - Yahoo Entertainment,https://www.yahoo.com/entertainment/5-tools-amazon-replace-almost-154328317.html
91,Adidas Grand Court Sneakers Are on Sale for $37 at Amazon | PEOPLE.com - PEOPLE,https://people.com/style/adidas-grand-court-sneaker-sale-amazon/
92,Jim Cramer says buy Amazon and the stocks of other companies with strong pricing power - CNBC,https://www.cnbc.com/2021/08/19/jim-cramer-says-buy-amazon-other-companies-with-strong-pricing-power.html
93,"National Dog Day 2021: Deals from Chewy, Petco, PetSmart, Walmart, Amazon - NJ.com",https://www.nj.com/shopping-deals/2021/08/national-dog-day-2021-deals-from-chewy-petco-petsmart-walmart-amazon.html
94,This $20 Amazon find needs to be in every kitchen - Yahoo Entertainment,https://www.yahoo.com/entertainment/20-amazon-needs-every-kitchen-120409561.html
95,The 5 best Amazon deals you can get this Wednesday - USA TODAY,https://www.usatoday.com/story/money/reviewed/2021/08/25/amazon-deals-save-eufy-sims-4-face-shields-and-more/5586958001/
96,Recent Match Report - Amazon vs T&T Riders 1st Match 2021 - ESPNcricinfo,http://www.espncricinfo.com/ci/content/story/1274859.html
97,"16 best women's T-shirts 2021, according to Amazon reviewers - TODAY",https://www.today.com/shop/best-womens-t-shirts-amazon-t228065
98,Jefferson Resident Reports Potential Amazon Scam To Local Authorities - 1380 KCIM,https://www.1380kcim.com/2021/08/26/jefferson-resident-reports-potential-amazon-scam-to-local-authorities/
99,Residents Share Concerns Over Proposed Amazon Facility In Lawrenceville - 90.5 WESA,https://www.wesa.fm/development-transportation/2021-08-24/residents-share-concerns-over-proposed-amazon-facility-in-lawrenceville
